{
  "id": "win_xp_silver",
  "displayName": "Luna Silver",
  "author": "Bubo",
  "accentColor": "#75788F",
  "prefersDarkTint": true,
  "backgroundGradient": {
    "colors": [
      "#80829935",
      "#80829915",
      "clear"
    ],
    "style": "linear",
    "startPoint": "topLeading",
    "endPoint": "bottomTrailing"
  },
  "previewColors": [
    "#75788F",
    "#A8ABBD"
  ],
  "secondaryAccent": "#999CB2",
  "barTint": "#616180",
  "barTintOpacity": 0.08,
  "platterTint": "#4C4C66",
  "platterTintOpacity": 0.03,
  "buttonStyle": "solid",
  "buttonShape": "capsule",
  "fontWeight": "regular",
  "fontDesign": "default",
  "badgeStyle": "tinted",
  "separatorStyle": "subtle"
}
