{
  "id": "graphite",
  "displayName": "Graphite",
  "author": "Bubo",
  "accentColor": "#6E6E80",
  "prefersDarkTint": true,
  "darkMoodMode": "auto",
  "backgroundGradient": {
    "colors": [
      "#9090A830",
      "clear"
    ],
    "style": "linear",
    "startPoint": "top",
    "endPoint": "bottom"
  },
  "previewColors": [
    "#85859A",
    "#3A3A46"
  ],
  "secondaryAccent": "#85859A",
  "barTint": "#525261",
  "barTintOpacity": 0.06,
  "platterTint": "#474752",
  "platterTintOpacity": 0.04,
  "buttonStyle": "solid",
  "buttonShape": "capsule",
  "fontWeight": "regular",
  "fontDesign": "default",
  "badgeStyle": "outlined",
  "separatorStyle": "system"
}