{
  "id": "sierra",
  "displayName": "Sierra",
  "author": "Bubo",
  "accentColor": "#B8823C",
  "prefersDarkTint": false,
  "darkMoodMode": "light",
  "backgroundGradient": {
    "colors": [
      "#E4A76B30",
      "clear"
    ],
    "style": "linear",
    "startPoint": "top",
    "endPoint": "bottom"
  },
  "previewColors": [
    "#E4A76B",
    "#B8823C"
  ],
  "secondaryAccent": "#E4A76B",
  "barTint": "#7A471F",
  "barTintOpacity": 0.06,
  "platterTint": "#B8823C",
  "platterTintOpacity": 0.04,
  "buttonStyle": "solid",
  "buttonShape": "capsule",
  "fontWeight": "regular",
  "fontDesign": "default",
  "badgeStyle": "tinted",
  "separatorStyle": "subtle"
}
