{
  "id": "mulberry",
  "displayName": "Mulberry",
  "author": "Bubo",
  "accentColor": "#A8447C",
  "prefersDarkTint": false,
  "darkMoodMode": "auto",
  "backgroundGradient": {
    "colors": [
      "#C2618F2E",
      "clear"
    ],
    "style": "linear",
    "startPoint": "top",
    "endPoint": "bottom"
  },
  "previewColors": [
    "#D98BB8",
    "#A8447C",
    "#5C2344"
  ],
  "secondaryAccent": "#D98BB8",
  "barTint": "#7A3059",
  "barTintOpacity": 0.06,
  "platterTint": "#66284A",
  "platterTintOpacity": 0.04,
  "buttonStyle": "solid",
  "buttonShape": "capsule",
  "fontWeight": "regular",
  "fontDesign": "default",
  "badgeStyle": "tinted",
  "separatorStyle": "subtle"
}
