{
  "id": "lavender",
  "displayName": "Lavender",
  "author": "Bubo",
  "accentColor": "#9461EB",
  "prefersDarkTint": false,
  "backgroundGradient": {
    "colors": [
      "#6B3DBF35",
      "#6B3DBF15",
      "clear"
    ],
    "style": "radial",
    "center": "center",
    "startRadius": 0,
    "endRadius": 400
  },
  "previewColors": [
    "#9461EB",
    "#CC7ABF"
  ],
  "secondaryAccent": "#7347C7",
  "barTint": "#613394",
  "barTintOpacity": 0.08,
  "platterTint": "#522E85",
  "platterTintOpacity": 0.06,
  "buttonStyle": "glass",
  "buttonShape": "capsule",
  "buttonTint": "#7A4CC7",
  "fontDesign": "default",
  "badgeStyle": "tinted",
  "separatorStyle": "subtle"
}
