{
  "id": "sage",
  "displayName": "Sage",
  "author": "Bubo",
  "accentColor": "#579966",
  "prefersDarkTint": true,
  "backgroundGradient": {
    "colors": [
      "#33613835",
      "#33613815",
      "clear"
    ],
    "style": "radial",
    "center": "bottomLeading",
    "startRadius": 0,
    "endRadius": 450
  },
  "previewColors": [
    "#579966",
    "#3D6647"
  ],
  "secondaryAccent": "#4C8057",
  "barTint": "#2E4C2E",
  "barTintOpacity": 0.05,
  "platterTint": "#244229",
  "platterTintOpacity": 0.04,
  "buttonStyle": "solid",
  "buttonShape": "capsule",
  "fontDesign": "default",
  "badgeStyle": "tinted",
  "separatorStyle": "subtle"
}
