{
  "id": "arctic",
  "displayName": "Arctic",
  "author": "Bubo",
  "accentColor": "#2E8FC5",
  "prefersDarkTint": false,
  "darkMoodMode": "light",
  "backgroundGradient": {
    "colors": [
      "#9ED9F530",
      "clear"
    ],
    "style": "linear",
    "startPoint": "top",
    "endPoint": "bottom"
  },
  "previewColors": [
    "#9ED9F5",
    "#2E8FC5"
  ],
  "secondaryAccent": "#7DD4F0",
  "barTint": "#2E6B94",
  "barTintOpacity": 0.06,
  "platterTint": "#246185",
  "platterTintOpacity": 0.04,
  "buttonStyle": "solid",
  "buttonShape": "capsule",
  "fontWeight": "regular",
  "fontDesign": "default",
  "badgeStyle": "tinted",
  "separatorStyle": "subtle"
}
