{
  "id": "midnight",
  "displayName": "Midnight",
  "author": "Bubo",
  "accentColor": "#5975BF",
  "prefersDarkTint": true,
  "darkMoodMode": "dark",
  "backgroundGradient": {
    "colors": [
      "#47619E3D",
      "clear"
    ],
    "style": "linear",
    "startPoint": "top",
    "endPoint": "bottom"
  },
  "previewColors": [
    "#141A33",
    "#47619E"
  ],
  "secondaryAccent": "#47619E",
  "barTint": "#1A1F40",
  "platterTint": "#141A33",
  "platterTintOpacity": 0.04,
  "buttonStyle": "solid",
  "buttonShape": "capsule",
  "fontWeight": "regular",
  "fontDesign": "default",
  "badgeStyle": "tinted",
  "separatorStyle": "subtle",
  "barTintOpacity": 0.06
}
