{
  "id": "classic",
  "displayName": "Classic",
  "author": "Bubo",
  "accentColor": "accentColor",
  "prefersDarkTint": false,
  "backgroundGradient": {
    "style": "clear",
    "colors": [
      "accentC20",
      "accentC05",
      "clear"
    ]
  },
  "previewColors": [
    "gray"
  ],
  "buttonStyle": "solid",
  "buttonShape": "capsule",
  "fontDesign": "default",
  "badgeStyle": "tinted",
  "separatorStyle": "subtle"
}
