{
  "id": "win_xp_blue",
  "displayName": "Luna Blue",
  "author": "Bubo",
  "accentColor": "#0054D6",
  "prefersDarkTint": true,
  "backgroundGradient": {
    "colors": [
      "#2961E035",
      "#2961E015",
      "clear"
    ],
    "style": "linear",
    "startPoint": "topLeading",
    "endPoint": "bottomTrailing"
  },
  "previewColors": [
    "#0054D6",
    "#388A29"
  ],
  "secondaryAccent": "#388A29",
  "barTint": "#003DAD",
  "barTintOpacity": 0.08,
  "platterTint": "#1A3885",
  "platterTintOpacity": 0.04,
  "buttonStyle": "solid",
  "buttonShape": "capsule",
  "fontWeight": "regular",
  "fontDesign": "default",
  "badgeStyle": "tinted",
  "separatorStyle": "subtle"
}
